{"schemaVersion":"1.0","workspaceId":"payments-work","generatedAt":"2026-08-11T00:00:00Z","facts":[{"statement":"Flow is ready","evidence":[{"kind":"flow","uri":"./.metaproject/flows/001","revision":"1","observedAt":"2026-08-11T00:00:00Z","trust":"primary"}],"observedAt":"2026-08-11T00:00:00Z","expiresAt":"2026-08-12T00:00:00Z","freshness":"fresh"}],"work":{"state":"unbound"},"knowHow":[{"kind":"memory","uri":"./.metaproject/memory/constraint","revision":"2","trust":"accepted","status":"fresh"}],"freshness":"fresh"}
